,id,avg_query_time,result,database
0,BM1,0.005392258801730349,"I'm in Love, Is It Love, My Love, Give Me Your Love, Love - Remastered 2010, Why I Love You, It's Love, No Love Like Yours, Summertime Magic, I Feel Love - 12"" Version",vector
1,BM1,0.05314713543630205,"I'll Be All You'll Ever Need, Who Are You, Limestone, Soldier, Love Sosa, I Feel Alive, Morph, Latina (feat. Maluma), Did It Again, Paint My Love - 2014 Remastered Version",document
2,BM2,0.004087923383340239,"Cake - Tokyo Mo Remix, It's Love, Love - Remastered 2010, Pride and Joy, Pride and Joy, Valentine, I'm in Love, Is It Love, My Love, Give Me Your Love",vector
3,BM2,0.08010313042788766,"Keep Watch, Future, Grindin', The Monster, The Monster, Heartless (feat. Rick Ross & Bigga Rankin), Mo Reala, Rap God",document
4,BM3,0.00550251460634172,"Is It Love, Give Me Your Love, I'm in Love, My Love, Why I Love You, No Love Like Yours, How You Love Me (feat. Conor Maynard & Snoop Dogg), Summertime Magic, Love - Remastered 2010, It's Love",vector
5,BM3,0.06681583954486996,"Tender Lover, Cheerleader - Felix Jaehn Remix Radio Edit, Nobody (feat. Athena Cage) - Single Version; 2007 Remaster, I Adore Mi Amor, Slow Motion, Let Your Love Flow, The Whole World (feat. Killer Mike), The Way, ANGST II, If I Lose Myself - Alesso vs OneRepublic",document
6,BM4,0.008340410833479837,"Is It Love, Give Me Your Love, I'm in Love, My Love, Why I Love You, No Love Like Yours, How You Love Me (feat. Conor Maynard & Snoop Dogg), Summertime Magic, Love - Remastered 2010, It's Love",vector
7,BM4,0.010857279993360862,"What Lovers Do (feat. SZA), What Lovers Do (feat. SZA), What Lovers Do (feat. SZA), What Lovers Do (feat. SZA)",document
8,BM5,0.00781702168751508,"Get Down, Make Love - Remastered 2011, Hold Up, Can't Get Enough (Remastered Album Version), Can't Get Enough - 2015 Remaster, First Love, Like I Love You, Like I Love You - Keanu Silva Remix, Like I Love You, Like I Love You, 21 Questions",vector
